<?xml version="1.0" encoding="UTF-8"?>
<turtle xmlns:xsi="http://www.w3.org/2001/XMLSchema-instance"
	xsi:schemaLocation="https://code.google.com/p/apple-tv2-xbmc/turtle/ turtle.xsd"
	xmlns="https://code.google.com/p/apple-tv2-xbmc/turtle/">

	<service action-id="perform_ping" name="ping" />

	<action id="__start__"
		pmessage="Welcome to TV on DESI ZONE|presented by AJ|based on Turtle">
		<move module="moves.Home" function="displayMenuItems" />
		<next-action name="On_Demand" id="display_TV_Shows"
			isfolder="true" />
		<next-action name="Live" id="display_Live_TV" isfolder="true" />
	</action>

	<!-- Common Video Link Player Moves -->

	<action id="snap_and_play_video">
		<move module="moves.PreProcessor" function="prepareVideoItem" />
		<move module="moves.SnapVideo" function="addPlaylistVideosInfo" />
		<move module="moves.SnapVideo" function="addVideoInfo" />
		<next-action name="Play" id="__play__" isfolder="false" />
	</action>

	<action id="snap_and_directplay_playlist">
		<move module="moves.PreProcessor" function="preparePlayListItems" />
		<move module="moves.SnapVideo" function="addPlaylistVideosInfo" />
		<move module="moves.SnapVideo" function="addVideoInfo" />
		<next-action name="Play" id="__play__" isfolder="false" />
	</action>

</turtle>